{"agent": {"framework": "CrewAI", "framework_version": "1.15.20", "model": "deterministic-crewai-stub", "name": "SABLE-CrewAI-Reference-Agent", "provider_base_url": "local", "runtime_trace_id": "crewai-8d7814ff-9689-4768-a51b-4e86ea87d5fa"}, "evidence_hash": "2bb6a444790e0f921e24a40f2148fd3d1b55682f8e00f9cffbe3c3e2ce408984", "execution": {"infrastructure_error": null, "termination": "final", "tool_calls": 1, "tools": ["inventory.reserve"]}, "outcome": {"checks_passed": 2, "checks_total": 2, "claimed_status": "success", "failure_labels": ["unknown"], "task_success": true}, "replay": {"checks_passed": 2, "checks_total": 2, "final_state_hash": "937e31b6d17219f92b26fb3c88acae6bf72108396cbd13c291624afa3fbee354", "replay_match": true, "task_success": true}, "schema_version": "sable.evidence.v0.6", "state": {"changed": true, "final_state_hash": "937e31b6d17219f92b26fb3c88acae6bf72108396cbd13c291624afa3fbee354", "initial_state_hash": "5568307329d5e3a4b463a6f4ea1299a61226fc595a36f6dc95bde056c5d6ecec"}, "task": {"family": "third_party_runtime", "goal": "Reserve 3 units of SKU-A without changing total stock.", "task_id": "SABLE-CREWAI-01"}}
