{"agent": {"framework": "LangGraph", "framework_version": "1.2.11", "model": "deterministic-reference-policy", "name": "SABLE-LangGraph-Reference-Agent", "provider_base_url": "local", "runtime_trace_id": "langgraph-b3c84b0e-e1c1-41d6-84da-c125eab0831a"}, "evidence_hash": "cb3cec7635d4636e19655af469becba9097c5251e00865b312f3f14c8f96daa8", "execution": {"infrastructure_error": null, "termination": "final", "tool_calls": 1, "tools": ["inventory.reserve"]}, "outcome": {"checks_passed": 2, "checks_total": 2, "claimed_status": "success", "failure_labels": ["unknown"], "task_success": true}, "replay": {"checks_passed": 2, "checks_total": 2, "final_state_hash": "937e31b6d17219f92b26fb3c88acae6bf72108396cbd13c291624afa3fbee354", "replay_match": true, "task_success": true}, "schema_version": "sable.evidence.v0.6", "state": {"changed": true, "final_state_hash": "937e31b6d17219f92b26fb3c88acae6bf72108396cbd13c291624afa3fbee354", "initial_state_hash": "5568307329d5e3a4b463a6f4ea1299a61226fc595a36f6dc95bde056c5d6ecec"}, "task": {"family": "third_party_runtime", "goal": "Reserve 3 units of SKU-A without changing total stock.", "task_id": "SABLE-LANGGRAPH-01"}}
